[
  {
    "id": "prismatic-evolutions-161-umbreon-ex",
    "name": "Umbreon ex",
    "set": "Prismatic Evolutions",
    "price": 129.99
  },
  {
    "id": "151-199-charizard-ex",
    "name": "Charizard ex",
    "set": "151",
    "price": 84.5
  },
  {
    "id": "evolving-skies-215-rayquaza-vmax",
    "name": "Rayquaza VMAX",
    "set": "Evolving Skies",
    "price": 412.0
  },
  {
    "id": "surging-sparks-128-pikachu-ex",
    "name": "Pikachu ex",
    "set": "Surging Sparks",
    "price": 67.25
  },
  {
    "id": "team-up-161-magikarp-wailord-gx",
    "name": "Magikarp & Wailord-GX",
    "set": "Team Up",
    "price": 1049.25
  }
]
